{ "schema": "sotercare.device_event.v1", "event_id": "3f1c2a9e-6b1d-4c4f-9a2e-1b2c3d4e5f60", "type": "fall", "device_id": "it-dev-0001", "node_mac": null, "detected_at": 1791770400123, "seq": 17, "boot_id": "b6a0f2c4-0000-4000-8000-000000000001", "clock_synced": true, "attempt": 1, "source": "udp", "detector": { "name": "fall_detector", "info": "FALL CONFIRMED: angle_delta=82deg, still_for=2.0s" } }
